Ticker,Idea,StockPrice,StockPriceDevelopment,MarketCap,Volume
ZUO,"Zuora, Inc., together with its subsidiaries, provides cloud-based subscription management platform that enables companies in various industries to launch, manage, and transform into a subscription business. The company offers Zuora platform that acts as an orchestration engine that allows customers quote-to-cash and revenue operations; and Zuora Billing that helps customers to set payment terms, manage hierarchical billing relationships, consolidate invoicing across multiple subscriptions, and tax transactions. It also provides Zuora Revenue, a revenue recognition automation solution; Zuora CPQ for configure, price, and quote various subscription options; Zuora Collect designed to/ handle the complicated function of payments associated with subscription-based businesses; Zephr, a digital subscriber experience platform for digital publishing and media industry; and Zuora Marketplace. It sells its products through its systems integrators, consultants, and ecosystem partners. Zuora, Inc. was incorporated in 2006 and is headquartered in Redwood City, California.",6.360000133514404,-56.9105688693054,1159124992.0,784908.0
ZVIA,"Zevia PBC, a beverage company, develops, markets, sells, and distributes various carbonated and non-carbonated soft drinks in the United States and Canada. It offers soda, energy drinks, organic tea, mixers, and kidz drinks. The company offers its products through various retail channels, including grocery distributors, national retailers, warehouse club, and natural products retailers, as well as e-commerce channels. It provides its products under the Zevia brand name. The company was founded in 2007 and is headquartered in Encino, California.",4.090000152587891,-70.03662808139866,125188200.0,200596.0
ZVRA,"Zevra Therapeutics, Inc., a rare disease company melding science, discovers and develops various proprietary prodrugs to treat serious medical conditions in the United States. The company utilizes its Ligand Activated Therapy technology to generate improved prodrug versions of FDA-approved drugs, as well as to generate prodrug versions of existing compounds that may have applications for new disease indications. Its prodrug product candidate pipeline is focused on the high need areas of attention deficit hyperactivity disorder, stimulant use disorder, and CNS rare diseases, including idiopathic hypersomnia (IH). The company's lead product candidate KP1077, which is under Phase II clinical trial for the treatment of IH and narcolepsy, is based on its prodrug of d-methylphenidate, known as serdexmethylphenidate. It is also developing KP879, a prodrug product candidate for the treatment of stimulant use disorder and is under Phase II clinical trial. In addition, the company has received FDA approval for AZSTARYS, a once-daily treatment for attention deficit hyperactivity disorder in patents age six years and older, and for APADAZ, an immediate-release combination product containing benzhydrocodone, a prodrug of hydrocodone, and acetaminophen. The company's product pipeline include, arimoclomol It has collaboration and license agreement with KVK-Tech, Inc. and Commave Therapeutics SA. The company was formerly known as KemPharm, Inc. and changed its name to Zevra Therapeutics, Inc. in February 2023. Zevra Therapeutics, Inc. was incorporated in 2006 and is headquartered in Celebration, Florida.",4.590000152587891,-29.166664520408887,164039008.0,159931.0
ZVSA,"ZyVersa Therapeutics, Inc., a clinical stage biopharmaceutical company, develops and commercializes products for the treatment of renal and inflammatory diseases. It engages in the development of VAR 200, a cholesterol efflux mediator, which is in Phase 2a clinical trial to the treatment of multiple renal indications, such as focal segmental glomerulosclerosis, alport syndrome, and diabetic nephropathy; and IC 100, a monoclonal antibody inflammasome ASC inhibitor that is in preclinical stage for treatment of multitude of inflammatory diseases. ZyVersa Therapeutics, Inc. is headquartered in Weston, Florida.",549.5,-84.06091370558376,5313230.0,1193973.0
ZWS,"Zurn Elkay Water Solutions Corporation engages in design, procurement, manufacture, and marketing of water management solutions in the United States, Canada, and internationally. It offers water safety and control products, including interceptors, water control and backflow, fire protection, PEX pipings and tubings, valves, fittings, and installation tools under the Zurn and Wilkis brand names. The company also provides flow systems products, comprising point drains, hydrants, fixture carrier systems, chemical drainage systems; and interceptors and separators, acid neutralization systems, and remote monitoring systems under the Zurn and Green Turtle brands. In addition, it develops, manufactures, and markets remote tank monitoring devices, alarm, software, and services. Further, the company offers sensor-operated flush valves under the Aquaflush, AquaSense, and AquaVantage brands; heavy-duty commercial faucets under the AquaSpec brand; water conserving fixtures under the EcoVantage and Zurn One brands; stainless steel products under the Just Manufacturing brand name, which include stainless steel sinks and plumbing fixtures, and various types of sinks, as well as drinking water products, such as dispensing and filtration products. It serves higher education, healthcare, retail, restaurant, hospitality, education, government, and fire protection markets. The company was formerly known as Zurn Water Solutions Corporation. Zurn Elkay Water Solutions Corporation was incorporated in 2006 and is headquartered in Milwaukee, Wisconsin.",21.149999618530273,-35.59683459117283,4676514304.0,979683.0
ZYME,"Zymeworks Inc., a clinical-stage biopharmaceutical company, discovers, develops, and commercializes biotherapeutics for the treatment of cancer. The company's lead product candidates include Zanidatamab, a human epidermal growth factor receptor 2 (HER2) that is in Phase 1, Phase 2, and Phase 3 clinical trials for the treatment of biliary tract, gastroesophageal adenocarcinomas, breast, colorectal, and endometrial cancers; and zanidatamab zovodotin, a HER2 -targeted antibody-drug conjugate that is in Phase 1 clinical trial for the treatment of advanced or metastatic HER2-expressing tumors. It also develops a pipeline of preclinical product candidates and discovery-stage programs in oncology, including immuno-oncology agents and other therapeutic areas. The company has strategic partnerships and collaborations with BeiGene, Ltd.; Celgene Corporation; Celgene Alpine Investment Co. LLC; GlaxoSmithKline Intellectual Property Development Limited; Daiichi Sankyo Co., Ltd.; Janssen Biotech, Inc.; LEO Pharma A/S; Iconic Therapeutics, Inc.; Merck Sharp & Dohme Research GmbH; and Atreca, Inc. Zymeworks Inc. was incorporated in 2003 and is headquartered in Vancouver, Canada.",7.860000133514404,-83.48392496677269,491743616.0,347394.0
ZYXI,"Zynex, Inc., together with its subsidiaries, designs, manufactures, and markets medical devices to treat chronic and acute pain; and activate and exercise muscles for rehabilitative purposes with electrical stimulation. The company offers NexWave, a dual channel, multi-modality interferential current, transcutaneous electrical nerve stimulation, and neuromuscular electrical stimulation (NMES) device that is marketed to physicians and therapists by field sales representatives; NeuroMove, an electromyography and electric stimulation technology device; InWave, an electrical stimulation product for the treatment of female urinary incontinence; and E-Wave, an NMES device. It also supplies private labeled products, including electrodes for the delivery of electrical current to the body, and batteries for use in electrotherapy products. In addition, the company distributes Comfortrac/Saunders for cervical traction, JetStream for hot/cold therapy, LSO Back Braces for lumbar support, and knee braces for knee support. Further, it offers Zynex Fluid Monitoring System (CM-1500), a fluid volume monitor, which is a non-invasive medical device for monitoring relative fluid volume changes used in operating and recovery rooms to detect fluid loss during surgery and internal bleeding during recovery; Zynex Wireless Fluid Monitoring System (CM-1600), a noninvasive monitoring device designed to measure relative changes in fluid volume in adult patients; NiCO CO-Oximeter, a laser-based noninvasive co-oximeter; and HemeOx tHb Oximeter, a laser-based total hemoglobin pulse oximeter. The company provides its products for use in pain management and control; stroke and spinal cord injury rehabilitation; hemodynamic monitoring; and pulse oximetry monitoring. It sells its products through direct sales force primarily in the United States. Zynex, Inc. was founded in 1996 and is headquartered in Englewood, Colorado.",13.90999984741211,93.19444744307326,293787008.0,226761.0
